[
  {
    "id": "conv_001",
    "type": "conversation",
    "conversation": [
      {
        "role": "system",
        "content": "你是一个有帮助的AI助手，能够回答各种问题。"
      },
      {
        "role": "user",
        "content": "请介绍一下机器学习的基本概念。"
      },
      {
        "role": "assistant",
        "content": "机器学习是人工智能的一个分支，它使计算机系统能够从数据中学习和改进，而无需明确编程。主要包括三种类型：监督学习（有标签数据）、无监督学习（无标签数据）和强化学习（通过奖励机制学习）。"
      },
      {
        "role": "user",
        "content": "能举个监督学习的例子吗？"
      },
      {
        "role": "assistant",
        "content": "当然可以。一个典型的监督学习例子是垃圾邮件分类。我们使用大量已标记为\"垃圾邮件\"或\"正常邮件\"的邮件数据来训练模型。模型学习这些邮件的特征后，就能够自动判断新邮件是否为垃圾邮件。"
      }
    ],
    "metadata": {
      "source": "教育对话数据集",
      "language": "zh",
      "domain": "机器学习",
      "difficulty": "easy",
      "created_at": "2024-01-15T10:00:00Z",
      "tags": ["教育", "机器学习", "基础概念"]
    }
  },
  {
    "id": "conv_002",
    "type": "conversation",
    "conversation": [
      {
        "role": "system",
        "content": "You are a helpful coding assistant."
      },
      {
        "role": "user",
        "content": "How do I implement a binary search in Python?"
      },
      {
        "role": "assistant",
        "content": "Here's a simple implementation of binary search in Python:\n\n```python\ndef binary_search(arr, target):\n    left, right = 0, len(arr) - 1\n    \n    while left <= right:\n        mid = (left + right) // 2\n        if arr[mid] == target:\n            return mid\n        elif arr[mid] < target:\n            left = mid + 1\n        else:\n            right = mid - 1\n    \n    return -1\n```\n\nThis function returns the index of the target element if found, or -1 if not found."
      }
    ],
    "metadata": {
      "source": "coding_qa_dataset",
      "language": "en",
      "domain": "programming",
      "difficulty": "medium",
      "created_at": "2024-01-16T14:30:00Z",
      "tags": ["coding", "algorithms", "python"]
    }
  }
]
