[
  {
    "id": "qa_001",
    "type": "qa",
    "question": "什么是GPU，为什么它对深度学习很重要？",
    "answer": "GPU（图形处理器）是专门设计用于并行处理的硬件。对于深度学习很重要，因为：1) 深度学习需要进行大量的矩阵运算，而GPU可以同时处理数千个操作；2) GPU的并行架构使训练大型神经网络的速度比CPU快数十倍甚至上百倍；3) 现代深度学习框架（如PyTorch、TensorFlow）都优化了GPU加速。",
    "metadata": {
      "source": "技术问答数据集",
      "language": "zh",
      "domain": "深度学习",
      "difficulty": "medium",
      "created_at": "2024-01-15T12:00:00Z",
      "tags": ["硬件", "GPU", "深度学习"]
    }
  },
  {
    "id": "qa_002",
    "type": "qa",
    "question": "What is the difference between supervised and unsupervised learning?",
    "answer": "Supervised learning uses labeled data where the correct output is known during training. The model learns to map inputs to outputs based on example input-output pairs. Common tasks include classification and regression. Unsupervised learning uses unlabeled data and the model tries to find patterns or structure in the data without explicit guidance. Common tasks include clustering and dimensionality reduction.",
    "metadata": {
      "source": "ml_qa_dataset",
      "language": "en",
      "domain": "machine_learning",
      "difficulty": "easy",
      "created_at": "2024-01-16T10:00:00Z",
      "tags": ["machine_learning", "concepts"]
    }
  },
  {
    "id": "qa_003",
    "type": "qa",
    "question": "解释一下什么是过拟合（overfitting）以及如何防止？",
    "answer": "过拟合是指模型在训练数据上表现很好，但在新数据上表现差的现象。这通常是因为模型过于复杂，记住了训练数据的噪声而不是学习到真正的模式。\n\n防止过拟合的方法包括：\n1. 增加训练数据量\n2. 使用正则化（L1、L2）\n3. 使用Dropout\n4. 早停（Early Stopping）\n5. 数据增强\n6. 简化模型结构\n7. 交叉验证",
    "metadata": {
      "source": "机器学习问答",
      "language": "zh",
      "domain": "机器学习",
      "difficulty": "medium",
      "created_at": "2024-01-17T09:30:00Z",
      "tags": ["机器学习", "过拟合", "正则化"]
    }
  }
]
